Gone to Earth,", and the rabbit in a basket. From a hook hung the bird in its cage, making little chirrupings of content. On the window-sill a bowl of",crocuses,"had pushed out white points.

But upon their love -- Edward's dawn of content and Hazel's laughter -- broke a loud imperious knocking. Edward went to",445361,445369,Flora
Gone to Earth,"and afterwards went and sandpapered his hands until they were sore. Hazel, enthroned in one of the broken chairs, fastened on Foxy's wedding-collar, made of blue",forget-me-not,".

Foxy, immensely dignified, sat on her haunches, her chin tucked into the forget-me-nots, immovably bland. She was evidently competent for her new role;",205045,205058,Flora
Gone to Earth,"properly placed, Edward; they should be all together in one part of the room.'

'Who'd that be?' Hazel inquired.

'1906,",plums,"; 1908, gooseberries; 1909, cherries, sugarless. The sugared ones are older.' Mrs. Marston spoke so personally that Hazel stared.

'It's",160026,160031,Flora
Gone to Earth,"wonderful faery-haunted days shrivelled. All she knew was that, now she lived at Undern, she never went out in the green dawn or came home wreathed in",pansy,"and wild snapdragon.

Reddin had imposed a deeper change on her than the change from maid to wife. He had robbed her of a thing frailer and rarer",409386,409391,Flora
Gone to Earth,"where the resin ran slowly like the dark blood of creatures beautiful, defeated, dying. She began to climb, holding to the grey, shining boles of",mountain ash-trees,". The bracken, waist-high at first, was like small hoops at the top of the wood, where the tiny golden tormentil made a carpet and the yellow",299226,299244,Flora
Gone to Earth,", that it seemed as if at any moment God might walk there as in a garden, delicate as a moth. Down by the stream Hazel found tall",water-plantains,", triune of cup, standing above the ooze like candelabras, and small rough-leaved forget-me-nots eyeing their liquid reflections with complaisance. She watched the birds bathe --",257960,257975,Flora
Gone to Earth,"she said, 'and I dunna like the hound-dogs.'

He stopped laughing.

Abel's harp beat upon them, and the soft thudding of feet on the",turf,", like sheep stamping, had grown in volume as the shyest were gradually drawn into the revelry.

A rainstorm, shaped like a pillar, walked slowly along",182393,182397,Flora
Gone to Earth,"not like it at all; she would talk about a minister's wife. Reddin had said she must go, but she must not.' She smelt the",roses,".

'No,' she said, 'I must ne'er go to the Hunter's Spinney -- not till doom breaks!' She said her prayers under",274185,274190,Flora
Gone to Earth,"had lately appeared on his forehead became very apparent.

In her room upstairs, papered with buttercups and daisies by Edward himself, and scented by a bunch of",roses,"he had given her, Hazel thought about Hunter's Spinney. Edward would not like her to go, and Edward had been kind -- kinder than anyone had",273631,273636,Flora
Gone to Earth,"the silent shadows, as she played with the thread of destiny, two presences eyed each other across her bright head -- one armed, the other bearing",roses,". Neither Mrs. Marston, with her antiphonal 'Double knit, double purl!' nor Edward, reading in his pleasant voice -- he rather fancied",233445,233450,Flora
Gone to Earth,". She looked across at Undern. There were roses everywhere, but the house had so strong a faculty for imposing its personality that it gave to the red",roses,"and the masses of traveller's joy that frothed over it a deep sadness, as if they had blown and dropped long since and were but memoried flowers. The",384224,384229,Flora
Gone to Earth,"only. For he took his own atmosphere with him wherever he went, and before his footsteps weakness fled and beauty folded.

The sky blossomed in parterres of",roses,", frailer and brighter than the rose of the briar, and melted beneath them into lagoons greener and paler than the veins of a young beech-leaf. The fairy",257576,257581,Flora
Gone to Earth,"were beans and bacon, there's few'd go clemmed,' said Hazel. 'That green un's proper, like when the leaves come new, and little small",roses,"and all.'

Put it on while I see what Vessons is doing.'

'He's grumbling in the kitchen, seemingly,' said Hazel.

Vessons",41517,41522,Flora
Gone to Earth,", and of a polished ferocity. They would have their prey.

He walked fast through the lonely fields where Hazel had passed on her mushrooming morning. The",roses,"that had then been in the bud were falling.

At Alderslea people stared at him as he went by, flushed and hatless.

From Alderslea to Wolf batch",359538,359543,Flora
Gone to Earth,"He fetched a stake and tied it up. I think,' he said to himself, 'that I was put into the world to tie up broken",roses,", and one that is not broken yet, thank God! It is miraculous that she has never come to harm, for that great overgrown boy, her",113488,113493,Flora
Gone to Earth,"fact, by not pleasing himself he would be outraging creed and race. The latch of her door was his to lift at any time. That chamber of",roses,"and gold, rainbows and silver cries like the dawn-notes of birds, was there for him like the open rose for the bee. His mother, too,",196532,196537,Flora
Gone to Earth,"them to-day. The swallows slid and circled across the water; their silence was no longer intimate, but alien. She looked across at Undern. There were",roses,"everywhere, but the house had so strong a faculty for imposing its personality that it gave to the red roses and the masses of traveller's joy that frothed over",384115,384120,Flora
Gone to Earth,", and they were merged in earth and their own multitudes.

Hazel opened the door and stood on the threshold, so that snow-flakes flattened themselves on the yellow",roses,"of her dress. Outside there was no world, only a waste of grey and white. Like leaves on a dead bird, the wrappings of white grew",45388,45393,Flora
Gone to Earth,". There's a glass in the first room you come to.
Then we'll have supper.'
'Sitting at the supper in a grand shining gown wi'",roses,"on it,' said Hazel ecstatically, her voice rising to a kind of chant, 'with a white cloth on table like school-treat, and the old",47364,47369,Flora
Gone to Earth,"the air -- half sickly, half sweet. The clipped bushes and the twisted chimneys made inky shadows like steeples on the grass, and great trees of",roses,", beautiful in desolation, dripped with red and white and elbowed the guelder roses and the elders set with white patens. Cherries fell in the orchard with the",31492,31497,Flora
Gone to Earth,"grass, and great trees of roses, beautiful in desolation, dripped with red and white and elbowed the guelder roses and the elders set with white patens.",Cherries,"fell in the orchard with the same rich monotony, the same fatality, as drops of blood. They lay under the fungus-riven trees till the hens ate them",31619,31627,Flora
Gone to Earth,"managed to get through by not looking in Abel's direction, being upheld by the knowledge that his pockets were getting very full.

When he read out, '",Cherries,", bottled. Mrs. Marston,' and Edward went to receive the prize, Reddin shouldered up to Hazel and asked:

'What time's he going?",178047,178055,Flora
Gone to Earth,"the reading, to the sense of which she paid no heed. It mingled with the drone of the hot bees falling in and out of the big red",peonies,", the far-off sound of grass-cutting, the grave, measured soliloquy of a blackbird hidden in the flame-flowered chestnut. Hazel felt that she would like to go on",288896,288903,Flora
Gone to Earth,".

Hazel felt very proud of Edward in chapel, and a little awed at his bearing and his abstracted air. She came near to loving him on the",lilac-scented,"Sundays when he read those old fragrant love-stories that he had dreaded. His voice was pleasant and deep.

'""And he took unto him his wife,",239390,239403,Flora
Gone to Earth,"the distant hills almost to their summits. The tops of Hunter's Spinney, God's Little Mountain, and the hill behind Undern stood out darkly green. The long",rose-briars,", set with pale coral buds, looked elvish against the wintry scene.

As Hazel descended the mist rose like a wall about her, shutting her off from",254334,254345,Flora
Gone to Earth,"with rage, as he advanced on Sally with his arm raised; the howling of the baby; the sound of her bees burning -- going off like",apple-pips,". A scene came back to her from the week before -- it seemed years ago. They had gone into the harvest-field after a hot, yellow day",403341,403351,Flora
Gone to Earth,"and a tawny pheasant led out her young. Now that the dew was gone, and cobwebs no longer canopied the field with silver, it was blue with",germander speedwell,"-- each flower painted with deepening colour, eyed with startling white, and carrying on slender stamens the round white pollen-balls -- worlds of silent, lovely",259146,259165,Flora
Gone to Earth,"left. We'll have them for dinner.' Edward looked at the woods across the batch, and wondered why the young fresh green of the larches and the",elm samaras,"was so sad, and why the cry of a sheep from an upper slope was so forlorn.

'I hope, Edward,' said Mrs. Marston",78845,78856,Flora
Gone to Earth,".

They set out early, for they had a good walk in front of them, and the April sun was hot. Hazel, under the pale green",larch-trees,", in her bright dress, with her crown of tawny hair, seemed to be an incarnation of the secret woods.

Abel strode ahead in his black cut-away",72852,72863,Flora
Gone to Earth,"of a fairy in a dream. His heart went out to her, not only for her morning air, her vivid eyes, her coronet of youth's rare",violets,", but for the wistfulness that was not only in her face, but in her poise and in every movement. He felt as he would to a small",85050,85057,Flora
Gone to Earth,"took off her hat and coat, to enter more splendidly. On her head, resting softly among the coils of ruddy hair, she put a wreath of",violets,", which grew everywhere at the Callow; a big bunch of them was at her throat like a cameo brooch.

When she entered the band faltered, and",84577,84584,Flora
Gone to Earth,"of long honeysuckle ropes that fell from the dead yews; curled in a last year's leaf; embattled in a mailed fir-cone, or resting starrily in the green",moss,", it seemed that God slumbered. At any moment He might wake, to bless or curse.

Reddin, not having a watchful eye or an attentive ear",227008,227012,Flora
Gone to Earth,"limp and crack the flower-beds. But it was cool in the shadow of the mountain-ash that grew near the currants, and a breeze laden with wild thyme and",moss,"fragrance played about the garden like an invisible child.

At eleven Martha appeared with cake and milk, and Edward returned from old Solomon's bedside. Then they went",288508,288512,Flora
Gone to Earth,", for the wood-track, for green places where soft feet scudded and eager eyes peered out and adventurous lives were lived up in the tree-tops, down in the",moss,".

She was fascinated by Reddin; she was drawn to confide in Edward; but she wanted neither of them. Whether or not in years to come she",130425,130429,Flora
Gone to Earth,"hands the night before.

Chapter 25

On Sunday evening, as usual, the little bell began to sound plaintively in the soft air which was like a pale",wild-rose,". Mrs. Marston had betaken herself out of her own door into that of the chapel with a good many sighs at the disturbance of her nap, and",297112,297121,Flora
Gone to Earth,"lament of the voices that rose and fell with artless cunning. The cottage was like a tree full of thrushes.

After their twelve o'clock dinner, Abel cut",holly,"for the wreaths, and Hazel began to make them. For the first time home seemed dull. She thought wistfully of the green silk dress and the supper",66055,66060,Flora
Gone to Earth,"that she had sinned against the Mountain so deeply that the old life could never return.

She remembered it as on the night of her wedding -- the",primroses,", red and white and lilac; the soothing smell of the clean sheets, that made her feel religious; the reassuring tick of the wall clock; Mrs",412299,412308,Flora
Gone to Earth,kissed her and turned to his cold room; but she -- she had made a noble fire in her little grate; and the room was full of,primroses,", red and white and lilac; and the wall-clock chimed instead of striking -- an intoxicating fairy chime; and there were clear sheets as of old.",431265,431274,Flora
Gone to Earth,"head shall perish.""'

It seemed particularly reassuring to Hazel as she brushed her long shining coils before the hanging mirror. There was a bowl of double",primroses,"-- red, mauve and white -- on the window-sill, and a card 'with Edward's love.'

Flowers in a bedroom were something very new",157465,157474,Flora
Gone to Earth,"creakings). Hazel never dreamt that he had taken his shoes off for her sake.

The moon, riding clear of cloud, flung the shadow of Edward's",primroses,"on the bed -- a large round posy like a Christmas-pudding with outstanding leaves and flowers clearly defined, all very black on the counterpane.

Undern seemed very",158294,158303,Flora
Gone to Earth,"birds' feathers and raised pink flowers. It would be very pleasant, Mrs. Marston reflected wistfully, to use it again. There were all the bottled",fruits,", too, and lemon-curd and jellies; and a wedding would be a very pleasant, suitable opportunity for making one of her famous layer cakes and for wearing",135624,135630,Flora
Gone to Earth,"low, golden sun. Evening stood tiptoe upon the windy hill-top.

Hazel had eaten quite a quantity of honey, and had made an appreciable difference in the",wimberry,"yield of half an acre, for she sipped hastily like a honey-fly. She was one of those who are full of impatience and haste through the sunny hours",264680,264688,Flora
Gone to Earth,".'

'You mustn't speak of your father like that, Hazel.'

'What for not? He be like that.'

'Are all these",apple-trees,"yours?' he asked to change the subject.

'No, they'm father's. But I get the windfa'ls and the bruised 'uns. I allus see",118312,118323,Flora
Gone to Earth,"Sally; so September came and drew out its shining span of days, and still Vessons and Sally were waiting.

Chapter 32

Morning by morning Hazel watched the",fuchsia,"bushes, set with small red flowers, purple-cupped, with crimson stamens, sway in beautiful abandon. The great black bees pulled at them like a calf at",390511,390518,Flora
Gone to Earth,"you'll chuck the parson.'

'I won'er you dunna see 'em, nights, watching you out of the black dark with their gold eyes, like",kingcups,", and the look in 'em of things dying hard. I won'er you dunna hear 'em screaming.'

His cause was lost, and he knew",190283,190291,Flora
Gone to Earth,".'

'I'm not an 'ooman growd!' cried Hazel shrilly. 'I dunna want to be, and I won't never be.'

The",pine-tops,"bent in the wind like attentive heads, as gods, sitting stately above, might nod thoughtfully over a human destiny. Someone, it almost seemed, had",73823,73832,Flora
Gone to Earth,", if I may have her to keep and defend, to glow in my house like a rose, I'll ask no more,' he murmured.

The",pine-tops,"bowed in as stately a manner as they had when Hazel cried, 'I'll never be a woman!' They listened like grown-ups to the prattle of a",109449,109458,Flora
Gone to Earth,"and swayed with such forlorn abandon. In the dusky places the hyacinths, broken but not yet faded, made a purple carpet, solemn as a pall.",Woodruff,"shone whitely by the path and besieged her with scent. Early wild-roses stood here and there, weighed down with their own beauty, set with rare carmine and",298648,298656,Flora
Gone to Earth,of the purple mist and shamed the hovel where Hazel dressed for her bridal. The cottage had sunk almost out of recognition in the foam of spring. Ancient,lilacs,stood about it and nodded purple-coroneted heads across its one chimney. Their scent bore down all other scents like a strong personality and there was no choice but to,201844,201850,Flora
Gone to Earth,"its many small-paned windows, faced the north sullenly. It was a place of which the influence and magic were not good. Even in May, when the",lilacs,"frothed into purple, paved the lawn with shadows, steeped the air with scent; when soft leaves lipped each other consolingly; when blackbirds sang, fell in",30161,30167,Flora
Gone to Earth,"seemed a fugitive presence from some other world trapped and panting to be free. The small patens of the beeches shone like green glass, and the pale spired",chestnuts,"were candelabras on either side of the steep path. In the bright breathless glades of larches the willow-wrens sang softly, but with boundless vitality. On sunny slopes",96854,96863,Flora
Gone to Earth,"of Hazel. The harp completed the load. They drove off amid the cheers of the next-door children, and took their leisurely way through the resinous fragrance of",larch-woods,".

The cream-coloured pony was lame, which gave the cart a peculiar roll, and she was tormented with hunger for the marigolds, which hung down near her",206764,206775,Flora
Gone to Earth,"tense silence, allowances being made for a prospective bride. 'Poor thing! she's upset.'

The exhibits, packed in a great bed of the vivid",star-moss,"that grew in the secret recesses of the woods, were waiting on the front step in their usual box. There were some wonderful new jellies that made Hazel",160741,160750,Flora
Gone to Earth,"unhurrying pomp far away beyond the horizon. She hurried along, leaving the beaten track, creeping under the broad skirts of the beeches and over the white prostrate",larch-boles,"where the resin ran slowly like the dark blood of creatures beautiful, defeated, dying. She began to climb, holding to the grey, shining boles of",299068,299079,Flora
Gone to Earth,in this whispering house for good? Who did she want to be with for good? Not Reddin. Edward? But he had not the passion of the,greenwood,"in him, the lust of the earth. He was not of the tremulously ecstatic company of wild, hunted creatures. If Reddin was definitely antagonistic, a",319872,319881,Flora
Gone to Earth,in every direction but the right one. Edward went to Hunter's Spinney every day. He began to find a new world among the budding hyacinths on the soft,leafy,"soil, breaking up on every side with the push of eager lives coming through, and full of those elusive, stimulating scents that only spring knows.

*",139858,139863,Flora
Gone to Earth,"benefits; amassing property -- these, the world says, are not waste of time. But to drink at the stoup of beauty; to lift the",leafy,"coverlet of earth and seek the cradled God (since here, if anywhere, He dwells), this in the world's eye is waste of time. Oh",260200,260205,Flora
Gone to Earth,"Every morning he appeared, neutral-tinted, from the house, and cried upon an apparently empty landscape; every morning they meandered through the seven gates from the secret",leafy,"purlieus where they spent the night.

Mysterious of eye, leisured, vividly red and white, they followed the old man as queens might follow an usher.",330225,330230,Flora
Gone to Earth,", roaring night. She grew more afraid of Reddin and Undern as the hours dragged on.

Reddin's presence tore to pieces the things she loved -- delicate",leafy,things -- as if they were tissue-paper and he had walked through it. Her pleasures seemed to mean nothing when he was with her and before his loud,409069,409074,Flora
Gone to Earth,", in all likelihood, be gone, not even a shadow left. Hazel wished she could catch them as they swept by, their shining breasts brushing the",grasses,". She knew they were sacred birds, 'birds with forkit tails and fire on 'em.' If sacredness is in proportion to vitality and joy,",437254,437261,Flora
Gone to Earth,"under her mocking amber eyes, her impish laughter. Then, looking from side to side with suppressed fury, he said: 'Them birds is after the",cherries,"! I'll get a gun. I'll shoot 'em dead!'

'If you shoot a blackbird, the milk'll turn bloody,' said Hazel; but",331775,331783,Flora
Gone to Earth,"all together in one part of the room.'

'Who'd that be?' Hazel inquired.

'1906, plums; 1908, gooseberries; 1909,",cherries,", sugarless. The sugared ones are older.' Mrs. Marston spoke so personally that Hazel stared.

'It's mother's exhibits, Hazel,' explained Edward",160059,160067,Flora
Gone to Earth,"no! Who should I be in love with, mother?'

'Quite right, dear. There is no one about here with more looks than a",brussels sprout,". Not that I say anything against sprouts. Martha, just go and see if there are any sprouts left. We'll have them for dinner.' Edward",78596,78611,Flora
Gone to Earth,"sighed in the tall larches, and once again, as on the day of the concert, they bent attentive heads towards Hazel. In the glades the wide-spread",hyacinths,"would soon be paling towards their euthanasia, knowing the art of dying as well as that of living, fortunate, as few sentient creatures are, in keeping",207173,207182,Flora
Gone to Earth,"woods were so far-reaching, so deep with shadow; the trees made so sad a rumour, and swayed with such forlorn abandon. In the dusky places the",hyacinths,", broken but not yet faded, made a purple carpet, solemn as a pall. Woodruff shone whitely by the path and besieged her with scent. Early",298571,298580,Flora
Gone to Earth,"Marston.'

Edward was so startled at this unhesitating frankness that he said nothing. But he silently buried several sweet hopes that had been pushing up like folded",hyacinths,"for a week. The old madness was upon him, but it was a larger, more spiritual madness than Reddin's, as the sky is larger and more",99776,99785,Flora
Gone to Earth,leading Jack Reddin's horse in every direction but the right one. Edward went to Hunter's Spinney every day. He began to find a new world among the budding,hyacinths,"on the soft leafy soil, breaking up on every side with the push of eager lives coming through, and full of those elusive, stimulating scents that only",139836,139845,Flora
Gone to Earth,"candelabras on either side of the steep path. In the bright breathless glades of larches the willow-wrens sang softly, but with boundless vitality. On sunny slopes the",hyacinths,"pushed out close-packed buds between their covering leaves; soon they would spread their grave blue like a prayer-carpet. Hazel, stooping in her old multi-coloured pinafore, her",97037,97046,Flora
Gone to Earth,"' he said, and did not wonder whether he would do himself. Then he gave a smothered exclamation. She had opened the window, pushing the snowy",ivy,"aside, and she leant out, her breast under its folds of silk resting on the snow.

She looked over his head into the immensity of night.",48463,48466,Flora
Gone to Earth,box. There were some wonderful new jellies that made Hazel long to be Mrs. Marston and have control of the storeroom. This was a dim place where,ivy,"leaves scraped the cobwebby window, and tall green canisters stood on shelves in company with glass jars, neatly labelled, and barrels of home-made wine; where hams",160989,160992,Flora
Gone to Earth,". He laid his hand on the cord, but Foxy prepared for conflict.

Edward's colleague turned away, hand to mouth. He was obliged to contemplate the",ivy,"outside the window while the altercation lasted.

'Whoever made you,' Hazel said, 'made Foxy. Where you can come, Foxy can come.",213825,213828,Flora
Gone to Earth,"the ideals of our descendants, like songs in the night, long before our firstborn is begotten. We, in whom the pollen and the dust, sprouting",grain,"and falling berry, the dark past and the dark future, cry and call -- we ask, Who is this Singer that sends his voice through the",88514,88519,Flora
Gone to Earth,"out, the cloths going in terraces according to the various heights of the tables; the tea-sets -- willow and Coalport, the feather pattern, and the",seaweed,"-- looking like a china-shop; the urn, now rakishly dinted, presiding. People paid for their supper on these occasions, and expected to have as",81673,81680,Flora
Gone to Earth,"Undern so long as she's not stand-off with me. No, by -- ! I'll have no nonsense after this! Here I am, sitting under a",tree,"like a dog with a treed cat!'

So now he was very angry. His look was like a lash as he said: 'You made that",237345,237349,Flora
Gone to Earth,"you can do is to come and talk to me sometimes.'

'Oh, I canna!'

'You must. Any spare time come to this",tree,". I shall generally be here.'

'But why ever? And you a squire with a big place and fine ladies after you!'

'Because",229921,229925,Flora
Gone to Earth,to the quarry at the mountain; the deserted mounds and chasms looked more desolate than ever in the spring world. Here and there the leaves of a young,tree,"lipped the grey-white steeps, as if wistfully trying to love them, as a child tries to caress a forbidding parent.

They climbed round the larger heaps and",74226,74230,Flora
Gone to Earth,"and muttered restlessly. She waited, frozen with suspense, until he was quiet again.

She could hear the hound baying, terrified at the noise of the",tree,". She dressed hurriedly, crept downstairs and went out by the back way, leaving the house, with its watchful windows, its ancient quiet which was not",414732,414736,Flora
Gone to Earth,"he said. 'Out of the grave and gate of death -- '

'Ah! But her as went in hanna come out. On'y a new",tree,". I'll be bound she wanted to come out.'

At this moment Edward's friend, who was to marry them, arrived.

'Now I shall go",211397,211401,Flora
